review,translation
"HOLDER IKKE HVAD DE LOVER!!De lovede os ved indmelding at vi kunne få 300 kr for henvisninger. Vi og vores drenge spurgte adskillige gange ind til det og fik hver gang at vide at pengene snart ville komme. Vi fik dem aldrig og meldte dem derfor ud og ville selvfølgelig ikke betale for den sidste tid, da vi ikke fik de penge de skyldte os. Vi gjorde heller ikke brug af abonnementet den sidste tid. Nu har vi udmeldt drengene og deres venner gør det samme. De siger også at den generel er gal med deres kundeservice. Nu har de så meldt os til inkasso og har meddelt at vi aldrig har gjort indsigelser selvom vi har masser beviser på det. Totalt fusker firma😤","DOES NOT KEEP PROMISES!! They promised us we would get 300 kr for each reference. Our bois and I requested the money multiple times and we were told every time that the money was on its way. We never recievede the money and thus we would not pay for the last time, since we didn't get the money they owed. We didn't use our subscription either. Now we have terminated the subscription of our bois and thier friends did the same. They also says that the customer service is bad. They have now refrenced us to the depth collectors and told us we should have made an inquiry even though we have a lot of proves that we did it. Scamming company."
"Nul stjerner og manglende fokus i sats Glostrup Stadivæk defekte maskiner. Bruser der er defekte, gulve er i stykker.Rengøring er svinsk.Og igen en ny center leder, der absolut ingen kompentencer har, til at vedligeholde et så ned slidt center.Og kommentar til bokse træning, som på ingen måde tager hensyn til resten af centeret, grundet manglende dør, musikken er sindssyg høj.  😡","Zero stars and lack of focus in Sats Glostrup stille defect machines. Showers are defect, floors are borken and the cleaning is discusting. Yet another new manager without any skill in charge of managing the run down center. Comments regarding boxing, there is no consideration for the rest of the center, due to missing door and a very loud music"
"Vi er lige startet og har fået en meget venlig, personlig modtagelse. Alt udstyr var tip, top. Glæder os til fortsat at komme SATS Køge, hvide by",We just started and have gotten a lot of friendly personal reception. All equipment was top notch. We look forward to join SATS Køge white city.
Det er umuligt at opsige sit abonnement uanset om jeg henvender mig fysisk eller prøver på hjemmesiden. Bliver henvist til at prøve og det virker ikke,"It is impossible to cancel ones subscription regardless of me going physically or through their webpage. Keep getting asked to try, but it does not work."
"Fitness på Skalbakken i Vanløse Er et lille super hyggeligt træningscenter Hvor der bliver drukket kaffe og sludre. Der er nu blevet malet nogle nye streger på væggene Men badeværelsesdørene er stadig meget slidte og grimme. Der trænges virkeligt til nye maskiner. De er meget slidte. PureGym Så der skal lige investeres lidt, før det bliver helt godt.","The fitness center at Skalbakken in Vanløse is a small and cozy center where people are drinking coffee and talking. The walls have been painted with new stipes, but the toilet doors are still very old and ugly. It really needs new machines. They are very used. PureGym needs to invest a bit before it gets good"
"Fint center med god instruktør. Er dog rigtig ked af, at seniortræning ligger så sent fredag. Kl. 9 eller 10 ville være bedre. Men vi seniorer kommer tit i sidste række.","Nice center with a  good instructor . I am a bit sad that the senior workout is so late on Friday, at 9 or 10 would have been better. We seniors usually are prioritized th least."
"(anmeldelsen er skrevet efter 8 besøg i centeret over periode på to måneder. Derudover har jeg en bofælle, der benytter centeret væsentligt oftere, som har samme oplevelse)Der mangler generel ledelse af centeret, ellers ville det ikke være så galt...- Der mangler konsekvent håndsprit i halvdelen af dispensere. - Alle toiletter er decideret ulækre. Det ligner umiddelbart, at der ikke tjekkes toiletter mere end 2-3 gange om dagen, hvilket er absurd, når man tænker på mængden af mennesker, der bruger centeret dagligt. Personale burde gå en runde hver time i peaktimerne, men flytter sig sjældent fra skranken, selv når der er flere på arbejde. Derudover lugter toiletterne harsk, hvilket tyder på manglende grundrengøring (andet end at tømme skraldespand og pudse spejl)- ingen vandautomater, hvilket betyder, at man er tvunget ind på ulækre toiletter for at fylde sin vandflaske. - Flere skabe i herrenes omklædningsrum virker ikke, hvilket betyder, at det kan være svært at finde et skab, når man skal træne i travle perioder. - Fejl og mangler overalt. Det er absurd, at tage så mange penge i kontigent, når standen på centret er så ringe. Reb til kabelmaksiner er f.eks. ved at falde fra hinanden. Mange kabelstativer virker ikke grundet manglende karabinhager eller andre relative små fejl, som let burde kunne løses. Den ene toiletdør i herrenes omklædning rum har manglet en lås i snart 2 måneder. Det samme gælder lyset i saunaen. Man føler sig efterhånden til grin, når SATS i ramme alvor kræver 409 kr (uden studie- eller ældrerabat) for det billigeste kontigent. Jeg ser frem til, at der kommer konkurrence nær Ørestaden, for det vil forhåbentlig være enden på Sats Fields eller deres dårlige serviceniveau.","The review is written after 8 visits to the center over a period of 2 months. Furthermore I have a roommate who experienced the same. There is a generel lack of leadership in the center, else it is not so bad. There is consistently missing hand sanitizer  from the dispensors. All the toilets are literally  nasty. It looks like the toilets are not checked more than 2-3 times a day, which is absurd givent he amount of peole who use the center daily. The personal should take a lap atleast once an our doing peak times, however they rarely moves from the desk, even when more people are at work. The toilets smell hards, which seems like a lack of cleaning (aside from emptying the bin and cleaning the mirros). No water taps which forces you to go to the bathrooms to fill your water bottle. Multiple of the storage devices are non functioning  which makes it hard to find a closet in the rush hours. Missing stuff all over the place. It is absurd that one can bill so much money when the center is in such a bad shape. The rope from the cablemachines are almost broken. Many cable stations are not working due to missing spring hooks or other small mistakes which could easily be solved. One of the doors to the male bathroom has been missing a lock for nearly 2 months. The same applies for the sauna. One really feels ashamed when sats in all seriousness charges 409 kr (without student or senior discount) for the cheapest subscription. I look forward to competition near Ørestaden, since this would be the end of Sats FIelds, or at least the bad customer service."
"Helt forferdelig luftkvalitet i viborgvej i Århus. Har forsøkt spørge både betjening, og online til puregym centralt. Men der sker ingen forbedring, og de skylder bare på at de ikke ejer bygningen selv, og at bygningsejere ikke tillader udluftning. Der har været virkelig dårlig luft i en måned nu, og det er simpelthen for dårligt for et fitnesscenter. Luftkvaliteten betyder altså ret meget når man står på løbebånd. Her er der behov for en hurtig løsning, for det er virkeligt hårdt at ville tage afsted til træning i det indeklima.Redigeret efter svar:Centerledelsen, de ansatte og puregym centralt er allerede kontaktet flere gange i løbet af oktober. Masser af undskyldninger, eller “vi sender den videre”, uden resultat. Så jeg er ikke videre optimistisk, når svaret her nok en gang er “vi sender den videre”.","Downright bad air quality at viborgvej in Århus. Have tried asking both staff and online for PureGym Central. There is no improvement, and they simply blame that they do not own the building themselves and that it is the landlord who is not allowing air ventilation. There have been such a bad smell for a month now, which is too not acceptable for a gym. Air quality means so much when you are using a treadmill. A solution is needed as soon as possible, it is not appealing to work out in that environment. Edited after response: Centerledelsen, the employed and PureGym Central has already contacted me on multiple occations during Oktober. Lots of excuses or ""we are sending it forward"" without result. I am not optimistic whent he reponse this time is probably ""we are sending it foward""."
Jeg syntes dør er et godt trænings center jeg syntes bare man skulle være mere obs på at der er nogle der træner i deres ude fodtøj men det står heller ikke nogen steder men alt i alt ok,"I think this is a good gym, however there should be more attention on people who workout without shoes, but this is not specificly mentioned anywhere, all around alright"
"Angår SATS Glostrup. Nu har 1/3 af spinningscyklerne ikke været funktionsdygtige i et halvt år, og resten har ikke været vedligeholdt. Hvis det ikke var for instruktørerne så havde jeg stoppet mit medlemskab.","Regarding SATS Glostrup. 1/3 of the spinning cyckles are non operational for half a year, and the rest are not kept up to date. If not for the instructors, I would have cancled my subscription."
"Søde rar unge mennesker der arbejder, de har et smil på læberne og er altid hjælpsomme sige hej og farvel..","Nice young people who works who are alwys smiling and helpful, they are always greeting and saying goodbye."
"Jeg træner tidligt om morgenen og starter inden der kommer personale. En fin ordning at det kan lade sig gøre. Nu har jeg imidlertid to gange inden for det sidste stykke tid oplevet mit kort er blevet afvist ved en tekniks fejl som jeg ikke kan få en forklaring på. Jeg har fået kortet tjekket og det fejler ikke noget. Jeg må så vente det kvarter der skal gå inden man kan bruge kortet igen. Her er jeg så kommet ind, men det er irriterende. Første gang det sket fik jeg byttet mit medlemskort, men samme fejl gentog sig med det nye.","I am always working out in the morning and beginning before staff arrive. It is nice that this is possible. I have recently tried two times for my card to be declined due to a technical error, which I cannot get an explanation of. I have had my card checked and there is nothing wrong. I have to wait for a 15 minutes untill I could use my card again. I have been let in, but it is frustrating. First time this happened I got a new membership card, but the same error occurred."
"Overskriften er ""Bedøm din seneste oplevelse""......der kunne stå ""de seneste oplevelser""!Helt generelt er jeg MEGET glad for at komme i SATS Vesterport, - men når en maskine først er i stykker ka' det ta' ugevis før den bliver repareret.Jeg har tidligere klaget min nødt ift. samme problem her på Trustpilot, og nu er den gal igen med en maskine hvor reparatøren har været tilkaldt i ugevis. ÆV!","The title is ""Rate your last experience""… it could have said ""last experiences""! in general I am VERY happy attending SATS Vesterport, but when a machine is broken it can take weeks for it to be fixed. I have complained before regarding the same problems here on Trustpilot, and it has happened again where a machine has broken down, and a technician has been called for weeks. Damn it!"
"Rykker på rykker bare forbi kæresten flytter kortDet umuligt at då lov til at betale tilmelder os betaling service men mails med rykker kommer stadig, vi kan ikke ringe til jer og I samarbejder ikke.En skam I har mere fokus på jeres UK ejer ind på os brugere.","Charges on charges due to partner moving. It is impossible to setup automatic payment payment, but more charges are still coming. We have tried calling you and you are not corporating. A shame you are more focused on UK owners that us customers."
"Har nu trænet regelmæssigt i SATS Birkerød i ca 4 måneder. Søde,  imødekommende, hjælpsomme medarbejdere. Gode trænere. Er blevet helt afhængig af deres cykelhold.  Mange forskellige hold. Rent, lækkert og god stemning.  Plads til alle slags mennesker.","Have been training for in SATS Birkerød for around 4 months. Sweet, welcoming and helpful staff. Good trainers. I have gotten addicted to their spinning class. Many different teams. Clean, nice and good vibes. Room for lots of different people."
"Jeg træner i SATS i Nærum og efter Thomas er startet er der virkelig kommet styr på det 👏🏻 Jeg har trænet der i 6 år, hvor lederne er skiftet ud flere gange. MEN nu er der styr på det. Thomas er nærværende og opmærksom, personalet er det samme og man får altid en frisk bemærkning, når man kommer til træning.Her er rent og pænt og styr på alt. En super fornemmelse hver gang jeg træner og det er mindst 5 gange om ugen 😊MvhMona 😊",I train in Nærum and after Thomas startet everything got under control. I have been training for 6 years where the managers have been changing several times. BUT now everything is under control. Thomas is personal and attentive and now that the staff is the same og you always get a nice comment when you go to train. It is clean and nice and everything is under control. A super feeling everytime I go to train and I'm there at least 5 times per week. Best regards Mona.
"Forfærdlig forløb hos sats, Sats sender min til inkasso selvom jeg har givet både min konto og kort oplysninger. Skam jer.hvis jeg kunne give 0, så have jeg gjort det.","Horrible course at sats, Sets sent mine to debt collection even though I gave them both my account and card information. Shame on you. If I could give 0 I would have done that"
Skal betale for en ekstra måned selvom jeg opsagde mit medlemskab inden den 1. i deres skod betingelser står der godt gemt væk at man er bundet +1 måned selv hvis man siger op inden den 1. Dårlig stil,I had to pay for an extra month even though I quit my membership before the 1st. In their shit terms and conditions they hid that you are tied +1 month even if you quit before the 1st. Bad service.
"SATS er helt opdateret og man bliver initialt glad når man er i gode omgivelser. Personalet er altid i mødekommen og pro-aktive også når klokken er 5 om morgenen, hvor jeg primært træner. Jeg træner i Kongens Lyngby. Jeg er Platinum medlem og har over 5000 medlemsdage.Kurt Bech, Kongens Lyngby","Sats has been completely upgraded and it makes you feel like you are in a nice environment. The staff are always friendly and proactive even when it's five in the morning when I'm mostly training. I train in Kongens Lyngby. I am a platium member og I have over 5000 days of me being a member. Kurth Bech, Kongens Lyngby"
"Jeg trænet 4-6 gange ugentligt i flere år, da der er altid et center i nærheden - super nemt 👍Så der er ingen undskyldning for ikke at klemme en hurtig træning ind i en travl hverdag, og stadig holde fast i en sund og aktiv livsstil.Generelt et venligt personale, bredt udvalg af maskiner, samt sjove og effektive hold 😊","I train 4-6 times per week for several weeks and there is always a center nearby - super easy. So there  is no excuse to not get a quick workout in during a busy weekday and still keep a healthy and active lifestyle. Generally a friendly staff, nice selection of machines as well as fun and effektive group training"
Det er altid en stor fornøjelse at træne på Clara’s hold i Helsingør. Hendes energi og gode humør er meget motiverende,It is always a great pleassure to train on Clara's team in Helsingør. Her energi and good sense of humour is very motivating.
"gulver i herrenes bade rum er glat så man skal gå meget forsigtig, så trænger nogle af maskiner udskiftes da de går istykker hele tiden",The floors in the men's bathrooms are slippery so you need to be careful also some of the machines need to be replaced and are always breaking
Den dårligste Santa jeg har set alt den styrke du må ikke så hygiejne 👎🏾👎🏾👎🏾👎🏾👎🏾👎🏾👎🏾👎🏾👎🏾👎🏾👎🏾På Nørrebro,The worst sats I have seen on Nørrebro
"Er kommet tilbage efter sommeren. Ny centerleder, lassesystemet gået ned,ingen tilknyttet personlig træner, parkeringsregler har ændret sig til kortere tiderne.En lidt dårlig start","I have returned back after the summer. New gym leader, the system broke, no personal trainer assigned, parking rules changed to shorter parking times. A kind of bad start"
"Dejlig imødekommende personale, som altid formår at holde centeret rent...Gode brugbare maskiner og godt med plads...Det som kan være irriterende, er at tlf nærmest fylder mere end træningen.. Alt for mange brugere, sidder fordybet i deres tlf imens de bruger maskinerne...Træn når der skal trænes 😀😀😉",Nice friendly staff who always keep a clean training center…Good usable machines and plenty of space…It can be annoying that the phone is almost taking up more time than the training…Way to many users pay attention to their phones while using the machines...Work out when you are supposed to be working out.
"Jeg er ikke medlem, jeg var på vej til at melde mig ind i dag på Rud Langgårdsvej, men pigen i receptionen sagde at jeres boksepude er faldet ned. Når den er oppe igen, så melder jeg mig ind. Lækker hjemmeside/app I har.","I'm not a member, I was about to become one at Rued Langgårsvej but the girl in the reception said that one of your boxing pillows fell down. When it is up again I will sign in. Nice website/app you have"
Jeg startede mit medlemskab i oktober og halvvejs inde ind i måneden vælger jeg at stoppe mit medlemskab fordi jeg stopper på skole i start november men så ser jeg at jeg ikke var meldt ud af ligevel så skulle betal for november men så melde jeg mig ud idag (1/11) også ser jeg at mit medlemskab stopper først den 31/12 så jeg skal betale for 2 måneder jeg ikke kan træne,I started my membership in October and halfway through the month I choose to stop mig membershup because I'm starting school in the beginning of Novermber but then I see that I was not signed out  even though I thought so but I still had to pay for November but then I signed out today (1/11) and I see that my membership doesn't stop until the 31/12 so I have to pay for two months where I can't train.
"Endnu engang beviser PureGym for mig, hvor lidt deres medlemmer betyder. Jeg møder ind i morges for at træne.. Der er to kvinder i bikesalen, som har rigtig højt musik, jeg går så ind og pænt spørger om de ikke vil skrue ned, hvor én af dem udbryder at det jo kun er i en time og at de skal have lov at være her, jeg forklar at det samme gælder mig og hun bliver bare ved med at gentage sig, så jeg går bare ud igen. Senere får jeg en mail med en advarsel pga. min “upassende adværd” og finder så ud af at den ene af de to kvinder var en instruktør. Jeg får slet ikke mulighed for at forsvar mig selv og fortælle min side og prøver at sende en klage til medlemservice, men bliver også afvist og får en kort svar på at de fastholder advarslen. Det er ren princip for mig og det er så uretfærdigt, jeg har været medlem i 10år + og altid opført mig ordentligt. At blive behandlet sådan efter al’ den tid som trofast medlem er fuldstændig for dårligt.Opdatering: Jeg har sendt en mail, men har ikke fået svar på endnu.","Once again PureGym prove to me how little their members mean to them. I go to the gym this morning to train.. There are two women in the bike room who are listening to very loud music, I go in and ask them nicely if they could please turn down the volume where one of them exclaimes that it's only one hour and there has to be room for them as well, I explain that the same should be true for me and he just keeps repeating herself so I just leave again. Later I get an email regarding my  ""inapropiate behavior"" and discover that one of the two women is an instructor. I don't even get the chance to explain myself and my side of the story and I try to send a complaint to customer service but also get rejected and get a short answer that they won't change the warning towards me. This is a pure case of princaple for me and it is so unfair I have been a member for 10+ years and have always behaved well. To get treated like this after all this time and being a faithful member is unfair. Update: I sent them an email but didn't get a response."
"Leg extension virker fortsat ikke. Ellers fungerer tingene i selve træningscentret godt. Personalet er venligt og hilser altid. Jeg er dog utilfreds med omklædning, bad og sauna. Der er meget beskidt og ulækkert. Der lugter ikke godt. Selve saunen har brug for et gennemsyn. Glasdøren lukker ikke til, så der blir ikke rigtig varmt. Der konstant fugtigt derinde og ikke en tør varme som der bør være i en sauna. Træbænken er næsten rådnet op og den nederste del er ved at falde af med søm der kigger frem. Sidst jeg var der var der toiletpapir på gulvet under bænken og gulvet bar præg af ikke at have været rengjort længe. Det er mildest talt uhumsk og ulækkert at bruge jeres faciliteter og prisen taget i betragtning for fitness abonnement hos jer vs. andre tilbud er det ikke i orden. Jeg håber snart det bliver fikset. Vh Jeppe","Leg extension continues to not work. Otherwise everything works well in the training center. The staff are friendly and always say hi. I am, however, dissatisfied with the changing rooms, showers and sauna. It is very dirty and gross. It doesn't smell nice. The sauna itself need a good review. The glass door doesn't close all the way, so it doesn't really get very warm. It is constantly moist in there  and not a dry heat like there should be in a sauna. The wooden bench is almost rotten and you can tell that the floor has not been cleaned for a while. It is mildly speaking disguisting and gross to user your facilities and the price of having a membership with you vs other fitness centers is not okay. I hope it will get fixed soon. Kind regards Jeppe."
Udemærket træningscenter med stort set hvad man skal bruge. Total nedslidt center dog og udstyret også slidt med mangler. Der  er plads til forbedringer.,Fine training center with basically everything you need. It is however very run down and the equiptment is run down and not up to standard. There is room for inprovement
"I perioden da jeg var hos Sats, var det ikke altid at sauna eller den kolde bruser virkede. Kablerne knækkede også ofte, og det tog lang tid inden at det blev fikset. Det har været en periode med sparetider, og en hård økonomi, så det er hvad det er. Dog er det stadig ikke optimalt.Hvad der virkelig ærger mig er, at jeg ikke længere kunne træne, så jeg ville opsige mit abonnoment. Sats tilbyde mig 2 måneders hviletilstand gratis. Det tager jeg imod.Jeg finder ud af, at jeg så ikke længere kan træne, så jeg siger abonnomentet op. Det betyder også, at hviletilstanden opsiges, og at jeg skal betale fra dags dato af +1 måned. Løbende plus en måned er meget normalt, men at de ikke oplyser tydeligt nok, at den hviletilstand de havde tilbudt mig vil blive opsagt skuffer mig meget.Jeg er 20 år, og har altid dyrket sport. Efter at jeg har færdiggjort marathon i start November, vil jeg melde mig ind i fitness igen. At Sats ikke er mere transparent, og at deres kundeservice ikke er til mere hjælp, gør at de mister en kunde, som ellers havde givet mange års indtjening.Edit. Jeg trænede på Nørrebro, så det kan godt være, at de andre steder ikke har lige så mange fejler og mangler.","During the time when I was by Sats, the sauna and cold shower were not always functioning. The cables also often break, and it took a long time before they were fixed. There has been a time of money saving, and a tough economy, so it is what it is. It is still not optimal, though. What is really unfortunate, is that I could not work out anymore, so I wanted to cancel my subscription. Sats offered me 2 months of rest period for free. I accept that. I find out that i cannot work out anymore, so i cancel my subscription. That also means, that the rest period is cancelled, and that I should pay of +1 month as I go from today. Payment as I go plus a month is pretty normal, but that they did not inform me clearly, that the rest period that they offered me would be cancelled disappoints me greatly. I am 20 years old, and have always done sports. After I have finished a marathon in the beginning of November, I will sign up for fitness again. That Sats is not more transparent, and that their customer support is not helpful, makes them lose a customer, that had provided them years of income. Edit. I worked out at Nørrebro, so it is possible that other places don't have as many problems."
