review,translation
"Jeg har desværre i morges haft en ret dårlig oplevelse af jeres kundeservice på Jens Baggesensvej i Aarhus. Jeg træner om morgenen og ankommer til centeret kl.7, hvor jeg finder ud af at jeg desværre har glemt mit kort. Intet problem tænker jeg, for jeg ved jo at der altid er personale som gør rent og fylder vare op mv., som må kunne hjælpe stakkels mig. En personlig træner står bag kassen og tager imod min besked, og går ned til personalet som er igang med rengøringen nedenunder. To minutter senere kommer han tilbage og meddeler, at det kan de desværre ikke hjælpe med da de først betjener kunder fra kl 8, så jeg kunne lige vente en time. Det synes jeg var en elendig oplevelse og jeg kommer til at melde mig ud af centeret på grund af det. Mvh. Steffen","This morning I have unfortunately had a bad experience of your customer service at Jens Baggesensvej in Aarhus. I work out in the morning and I arrive at the gym at 7 o'clock, where I find out I unfortunately have forgotten my card. No problem, I think, because I know there is always staff who clean and put products on shelves etc., who presumably could help poor me. A personal trainer is at the counter and receive my message, and walks down to the staff who are cleaning downstairs. Two minutes later he comes back and informs me, that they unfortunately can't help, since they only serve customers after 8, so I had to wait an hour. I find that to be a terrible experience and I will cancel my subscription because of that. Kind regards, Steffen."
"Sats Frederiksberg falkoner Absurd dårlig service er den første…Absurd Elendig dårlig kundeservice og manglende empatiservice er den første sætning at jeg vælger at indlede denne anmeldelse medEftermiddagen til onsdag Bliver jeg mødt en der hverken siger hej elller hav en god dag, hun har travlt med at snik snakke med sin kollega. Men jeg er blevet bemærket da jeg bliver fuldt efter ind i omklædning, hvor en medarbejder går rundt og kigger, er grænseoverskridende jeg synes er så dårlig stil og ikke mindst utrolig dårlig service. musikken så høj at selv med høretelefoner kan man ikke hører andet en støj og dårlig musik!","Sats Frederiksberg falkoner. Absurdedly bad service the first. Absurd terrible bad customer service and lacking empathy service is the first sentence that I choose to begin this review with. The afternoon wednesday I meet someone who never says hi or have a good day, She is busy with small talk with her colleague. But i get noticed when i am followed into the changing room, where an employee is walking around and looking, crosses personal boundaries and i think it is bad behaviour, and not the least really bad service. The music is so loud that even with headphones, you can't hear anything but noice and bad music."
"Min yndling træningscenter på Nygårdsvej , specielt efter Betina begyndt som centerleder og ikke mindst personale,de gør det virkelig godt.Medlemmer skal være bedre til at rydde op efter dem selv.Evig problem ...:)Men Musikken i centret er ofte meget  meget høj ( i hvert fald tidlig morgen )og det er ofte hip hop og gangsta rap,måske skulle man prøve  musikken der henvender sig til et bredere publikum ,alle har øretelefoner i ørerne alligivel ,musikken kan være så høj at man ikke kan høre sin egen musik i øretelefoner og henvender jeg mig til personale , men de er ikke meget for at skrue ned.","My favorite gym at Nygårdsvej, especially after betine began as gym manager and not the least the staff, they do it really well. Members have to be better at cleaning up after themselves. Eternal problem…:) but the music in the gym is often very very load (at least early in the morning) og it is often hip hop and gangta rap, maybe one should try music that is directed at a wider audience, everyone's wearing headphones anyway, the music can be so loud that you can't hear your own musik in the headphones and if i talk to the staff, but they are not much for turning it down."
"Efter at have været kunde hos SATS og altid betalt min regninger (til overpris) igennem 7 år, skiftede jeg forrige måned mobil efter jeg blev ansat ved en ny virksomhed. Dette medførte at min regning ikke blev betalt til tiden - min fejl 100%. Det næste der skete var dog at SATS direkte sendte mig til Intrum - et inkassofirma af værste skuffe. Super skuffet over behandlingen fra SATS' side. På den anden side rigtig godt at blive gjort klar over hvordan jeg bedre kan bruge 400kr hver måned end på en elendig virksomhed :-)","After being a customer by sats and always having paid my bills (overpriced) throughout 7 years, I got a new cellphone last month after getting anew job. This meant that my bill was not paid in time -- 100% my fault. The next thing that happens was that SATS sent my to Intrum -- a debt repayment firm of the worst kind. Really disappointed in the treatment from SATS. On the other hand really good to be made aware of how i can use 400 kr every month on a terrible firm :-)"
"Jeg betalte for mit medlemsskab for tre dage siden og er har stadig ikke fået en bekræftelse på indmelding eller aktiveret mit medlemsskab. Dette er ikke sket, på trods af at jeg blev forsikret om, at det ville blive gjort i dag, da jeg ringede ind kl 08:30.Det er i forvejen uoptimalt, at man skal vente fra betaling til oprettelsen af medlemskabet, men det giver en endnu dårligere oplevelse, når man bliver stillet noget i udsigt, som ikke bliver til noget.","I paid for my membership three days ago and I still haven't got my confirmation on my sign up or got my membership activated. This hasn't happened, even though I was assured, that I would be done today, when I called at 8:30. It is already suboptimal, that you have to wait from the payment until the establishment of the membership, but it gives an even worse experience, when something is put into view, which doesn't materialize."
"I trænger til nye maskiner, det flyder med papir, toiletterne i omklædningsrummet er ulækre, håndvægte er sat op tilfældigt og nogle gange spredt rundt i centret, andre kunder sætter stort set aldrig vægte på plads.Bortset fra maskinerne kan ovenstående rettes op på ved at begynde at sætte krav til kunderne. F.eks. lave en video om god opførsel i et fitness center.","You need new machines, it is flooding with paper, the toilets in the locker rooms are disgusting, the dumbbells are placed randomly and sometimes spread out around the gym, other customers almost never put the weights back in place. Apart from the machines, the previously mentioned can be corrected by having demands for the customers. Fx. make a video about good behavior in the gym."
Min afd på V Bro Kh er godt indrettet og personalet er imødekommende. Godt råd til kæden: Sats meget mere på +50 årige kunder. Den ene undersøgelse efter den anden dokumentere at styrketræning er den vigtigste søjle til at bevare en bevægelig og rask krop.Satsen kunne være abn tilbud på specielle stille tidspunkter.,My department at V Bro Kh is well furnished and the staff is friendly. A piece of advice for the chain: Bet more on the +50 year old customers. One study after another documents that strength training is the most important pillar for maintaining a mobile and healthy body. The bet could be subscription deals for particular quiet times.
"Fik den værste behandling i Hobro efter center leder har ændret i mit medlemskab. Mit kort virkede ikke, der går 14 dage men trælse sms fra center leder og staff, før kortet virker igen.. centeret er beskidt og flere maskiner er i stykker. Kan ikke anbefale Hobro centeret . Men Gug er super fin.","Got the worst treatment in Hobro after gym manager has changed my memebership. My card did not work, 14 days pass with shitty messages from gym manager and staff, before the card works again... The gym is dirty and multiple machines don't work. Cannot recommend the Hobro gym. But Gug really nice."
"Priserne stiger, mens centrene forfalder mere og mere. :( Mange af redskaberne er virkelig slidte og nogen helt ødelagte. Standarden af centrene varierer også en del, hvilket er trist, når man bor tæt på et center, som ikke bliver prioriteret så meget, men stadig betaler det samme…","The prices are rising, while the gym decays more and more. :( Much of the equipment is really worn out and some are completely broken. The standards of the gyms also vary a lot, which is sad, when you live close by a gym, which isn't being prioritized as much, but you still pay the same amount..."
Dejligt jam dansehold i frb Falkoner 17.45 idag. God energi dygtige nærværende instruktører. Selve centeret er meget slidt og mørkt og dårlige løbebånd . Bliver mit stamcenter valby jeg vil have styrketræning i og håber på flere dansehold,Wonderful jam dance group in frb Falkoner 17:45 today. Good energy competent and present instructors. The gym itself is very worn out and dark and bad treadmills. Will be my regular gym Valby I want strength training and hoping for more dance teams.
"SATS Glostrup's sauna er altid i stykker, 2-3 gange om måneden er den i stykker. Den kolde bruser har heller ikke virket i 2 måneder. Find et andet center hvor disse ting måske virker ellers find en anden udbyder af fitness.","Sats Glostrup's sauna is always broken, 2-3 times a month it is broken. The cold shower has also not worked for 2 months. Find another gym where these things might work otherwise find another gym provider."
"God stemning i Sats  og et utal af træningsmuligheder, men det tager for lang tid med at få repareret og udskiftet defekt udstyr.","Good vibes in Sats and countless ways of working out, but it takes too long to get defective equipment replaced."
"Der er gode maskiner, som dog tit flyttes rundt. Rimeligt gode omklædningsforhold og skabe, hvor der tit mangler bøjler.","There are good machines, that are moved around often, though. Pretty good changing accomodation and lockers, where coat hangers are often missing."
Rent og pænt fitnesscenterLange åbningstider og mange forskellige muligheder for at træne styrke og kondition.,Clean and nice looking gym. Long opening hours and many different possibilities for strength training and cardio.
